{
  "$schema": "https://json-schema.org/draft/2020-12/schema",
  "title": "Planning example structural schema; production validation is P03",
  "type": "object",
  "required": [
    "schema_version",
    "release_ready",
    "senses",
    "challenges"
  ],
  "additionalProperties": false,
  "properties": {
    "schema_version": {
      "const": 1
    },
    "release_ready": {
      "const": false
    },
    "senses": {
      "type": "array",
      "minItems": 1,
      "items": {
        "type": "object",
        "required": [
          "id",
          "lemma",
          "part_of_speech",
          "definition",
          "examples",
          "collocations",
          "status",
          "revision",
          "provenance"
        ],
        "properties": {
          "id": {
            "type": "string",
            "pattern": "^sense\\."
          },
          "lemma": {
            "type": "string",
            "minLength": 1
          },
          "definition": {
            "type": "string",
            "minLength": 1
          },
          "examples": {
            "type": "array",
            "minItems": 3,
            "items": {
              "type": "string"
            }
          },
          "collocations": {
            "type": "array",
            "minItems": 2,
            "items": {
              "type": "string"
            }
          },
          "status": {
            "const": "draft"
          },
          "revision": {
            "type": "integer",
            "minimum": 1
          }
        }
      }
    },
    "challenges": {
      "type": "array",
      "minItems": 1,
      "items": {
        "type": "object",
        "required": [
          "id",
          "sense_ids",
          "mode",
          "skill",
          "prompt",
          "answer_rule",
          "rationale",
          "status",
          "revision"
        ],
        "properties": {
          "id": {
            "type": "string",
            "pattern": "^item\\."
          },
          "sense_ids": {
            "type": "array",
            "minItems": 1,
            "items": {
              "type": "string"
            }
          },
          "mode": {
            "enum": [
              "context",
              "forge",
              "precision",
              "repair"
            ]
          },
          "skill": {
            "enum": [
              "recognition",
              "recall",
              "precision",
              "usage"
            ]
          },
          "status": {
            "const": "draft"
          },
          "revision": {
            "type": "integer",
            "minimum": 1
          },
          "answer_rule": {
            "type": "object",
            "required": [
              "kind",
              "accepted"
            ],
            "properties": {
              "kind": {
                "enum": [
                  "option_ids",
                  "exact_words"
                ]
              },
              "accepted": {
                "type": "array",
                "minItems": 1,
                "items": {
                  "type": "string"
                }
              }
            }
          }
        }
      }
    }
  }
}
